{
  "schema": "askquran_answer_templates_v1",
  "version": 1,
  "created_at_utc": "2025-12-21T23:19:29Z",
  "source": {
    "name": "ie-ai-py",
    "ontology": "topic_ontology_v1.yaml",
    "topic_pack": "topic_pack_v1.json"
  },
  "templates": [
    {
      "id": "story.nuh",
      "title": {
        "en": "Story of Nuh",
        "ur": "???",
        "ar": "???"
      },
      "sections": [
        {
          "id": "ark",
          "title": {
            "en": "Ark",
            "ur": "???",
            "ar": "???"
          },
          "verse_keys": [
            "2:248",
            "7:64",
            "10:22"
          ]
        },
        {
          "id": "flood",
          "title": {
            "en": "Flood",
            "ur": "???",
            "ar": "???"
          },
          "verse_keys": [
            "5:83",
            "6:93",
            "7:64"
          ]
        },
        {
          "id": "salvation",
          "title": {
            "en": "Salvation",
            "ur": "???",
            "ar": "???"
          },
          "verse_keys": [
            "7:64",
            "10:73",
            "10:90"
          ]
        }
      ]
    },
    {
      "id": "story.ibrahim",
      "title": {
        "en": "Story of Ibrahim",
        "ur": "???",
        "ar": "???"
      },
      "sections": [
        {
          "id": "trials",
          "title": {
            "en": "Trials",
            "ur": "???",
            "ar": "???"
          },
          "verse_keys": [
            "2:17",
            "2:24",
            "2:39"
          ]
        },
        {
          "id": "house",
          "title": {
            "en": "Sacred House",
            "ur": "???",
            "ar": "???"
          },
          "verse_keys": [
            "2:125",
            "2:126",
            "2:127"
          ]
        },
        {
          "id": "legacy",
          "title": {
            "en": "Legacy",
            "ur": "???",
            "ar": "???"
          },
          "verse_keys": [
            "2:124",
            "2:136",
            "2:140"
          ]
        }
      ]
    },
    {
      "id": "story.lut",
      "title": {
        "en": "Story of Lut",
        "ur": "???",
        "ar": "???"
      },
      "sections": [
        {
          "id": "actions",
          "title": {
            "en": "Actions",
            "ur": "???",
            "ar": "???"
          },
          "verse_keys": [
            "2:197",
            "4:15",
            "4:16"
          ]
        },
        {
          "id": "warnings",
          "title": {
            "en": "Warnings",
            "ur": "???",
            "ar": "???"
          },
          "verse_keys": [
            "7:37",
            "7:179",
            "7:188"
          ]
        },
        {
          "id": "outcome",
          "title": {
            "en": "Outcome",
            "ur": "???",
            "ar": "???"
          },
          "verse_keys": [
            "2:24",
            "2:74",
            "5:3"
          ]
        }
      ]
    },
    {
      "id": "story.musa",
      "title": {
        "en": "Story of Musa",
        "ur": "???",
        "ar": "???"
      },
      "sections": [
        {
          "id": "pharaoh",
          "title": {
            "en": "Pharaoh",
            "ur": "???",
            "ar": "???"
          },
          "verse_keys": [
            "2:49",
            "2:50",
            "3:11"
          ]
        },
        {
          "id": "signs",
          "title": {
            "en": "Signs",
            "ur": "???",
            "ar": "???"
          },
          "verse_keys": [
            "2:60",
            "7:107",
            "7:115"
          ]
        },
        {
          "id": "sea",
          "title": {
            "en": "Sea",
            "ur": "???",
            "ar": "???"
          },
          "verse_keys": [
            "2:50",
            "2:164",
            "5:96"
          ]
        }
      ]
    },
    {
      "id": "story.yusuf",
      "title": {
        "en": "Story of Yusuf",
        "ur": "???",
        "ar": "???"
      },
      "sections": [
        {
          "id": "dream",
          "title": {
            "en": "Dream",
            "ur": "???",
            "ar": "???"
          },
          "verse_keys": [
            "8:43",
            "10:64",
            "12:4"
          ]
        },
        {
          "id": "prison",
          "title": {
            "en": "Prison",
            "ur": "???",
            "ar": "???"
          },
          "verse_keys": [
            "12:25",
            "12:32",
            "12:33"
          ]
        },
        {
          "id": "reunion",
          "title": {
            "en": "Reunion",
            "ur": "???",
            "ar": "???"
          },
          "verse_keys": [
            "12:4",
            "12:5",
            "12:6"
          ]
        }
      ]
    },
    {
      "id": "story.isa",
      "title": {
        "en": "Story of Isa",
        "ur": "???",
        "ar": "???"
      },
      "sections": [
        {
          "id": "birth",
          "title": {
            "en": "Birth",
            "ur": "???",
            "ar": "???"
          },
          "verse_keys": [
            "3:39",
            "3:45",
            "3:49"
          ]
        },
        {
          "id": "miracles",
          "title": {
            "en": "Miracles",
            "ur": "???",
            "ar": "???"
          },
          "verse_keys": [
            "3:49",
            "5:3",
            "5:110"
          ]
        },
        {
          "id": "disciples",
          "title": {
            "en": "Disciples",
            "ur": "???",
            "ar": "???"
          },
          "verse_keys": [
            "3:52",
            "5:72",
            "5:111"
          ]
        }
      ]
    },
    {
      "id": "story.dhulqarnayn",
      "title": {
        "en": "Story of Dhul-Qarnayn",
        "ur": "???",
        "ar": "???"
      },
      "sections": [
        {
          "id": "journeys",
          "title": {
            "en": "Journeys",
            "ur": "???",
            "ar": "???"
          },
          "verse_keys": [
            "18:86"
          ]
        },
        {
          "id": "barrier",
          "title": {
            "en": "Barrier",
            "ur": "???",
            "ar": "???"
          },
          "verse_keys": [
            "18:94",
            "18:95",
            "18:97"
          ]
        },
        {
          "id": "justice",
          "title": {
            "en": "Justice",
            "ur": "???",
            "ar": "???"
          },
          "verse_keys": [
            "18:86",
            "18:87",
            "18:88"
          ]
        }
      ]
    },
    {
      "id": "story.talut_jalut",
      "title": {
        "en": "Story of Talut and Jalut",
        "ur": "???",
        "ar": "???"
      },
      "sections": [
        {
          "id": "selection",
          "title": {
            "en": "Selection",
            "ur": "???",
            "ar": "???"
          },
          "verse_keys": [
            "2:247",
            "2:249",
            "2:251"
          ]
        },
        {
          "id": "river",
          "title": {
            "en": "River Test",
            "ur": "???",
            "ar": "???"
          },
          "verse_keys": [
            "2:249"
          ]
        },
        {
          "id": "battle",
          "title": {
            "en": "Battle",
            "ur": "???",
            "ar": "???"
          },
          "verse_keys": [
            "2:249",
            "2:250",
            "2:251"
          ]
        }
      ]
    }
  ]
}